,date,developerResponse,review,rating,isEdited,userName,title
34,2022-06-11 17:24:41,"{'id': 30485963, 'body': 'Thank you for your review. And for all the great work you do at Mayo. With gratitude!', 'modified': '2022-06-21T20:11:49Z'}","I’ve been away from MoodFit for a while. I work at Mayo in the Pain Management Program and while helping patients and a hectic schedule,  I don’t always document my own thoughts and feelings.
Thank you for this App! It’s right on with CBT, mindfulness, and keeping me aware of my own stuff. 
CEM",5,False,Kevcat97,Keeping Me Grounded
35,2021-06-02 22:44:59,"{'id': 23206726, 'body': 'Glad you found us and grateful for your review! ', 'modified': '2021-06-04T23:55:53Z'}",I haven’t been using this app for long but the statements that are sent really help ground me. I found it as I was researching on resilience for my project ideas. Team has agreed this is going to be one of the interventions to help!! Paying it forward helps with resilience too😊,5,False,future geriatric np,Works!
36,2021-06-15 19:06:09,"{'id': 23532994, 'body': 'Thank you for the review! We love hearing how Moodfit has been helpful to our users. With gratitude! ', 'modified': '2021-06-23T02:04:11Z'}","Love this app! I would HIGHLY recommend it for all ages. It definitely helps. Especially, people w/chronic anxiety & depression. My daughter has both plus PTSD and it helps her too. The free version is amazing as is, we are thinking of upgrading.",5,False,"Witchy,Mama",Highly recommend this app
37,2020-12-24 18:09:06,"{'id': 20562246, 'body': 'Thank you for the great review! Very happy to hear Moodfit has been helpful with your journey. If you ever run into any performance problems please send us an email, hello@getmoodfit.com. Gratefully yours!', 'modified': '2021-01-21T20:14:31Z'}",This app is helping me to pinpoint parts of my day where I’m having issues and also has great reminders and tips! And I like getting the emails too actually! It acted a little slow the other day but i also changed phones. It’s doing better now.,5,False,angiec187,Very helpful!
38,2022-04-28 16:22:13,"{'id': 30486035, 'body': ""Thank you for the review! You're so right - awareness + the regular use of best practices can really make a difference. With gratitude!"", 'modified': '2022-06-21T20:15:18Z'}","Just the simple act of logging how u feel can help. Logging what I am grateful for helps too. And finally deep breathing, it helps me right myself.  This app has become a big help and worth the time to do. It is effective.",5,False,artist/anne,When I go off the rails from anxiety…
39,2021-02-11 19:16:05,"{'id': 21119964, 'body': 'Thank you for the review! You just made our day hearing about how Moodfit has been helpful to you. With gratitude!', 'modified': '2021-02-17T18:20:58Z'}","This app has changed my life! It has so many features and keeps me constantly in check with my mental health. I’m more aware of my thoughts , feelings, and reality. Helps me stay grounded and has tons of in app features to get you through tough moments. 10/10 recommend!",5,False,Megan857472,Mood Fit
40,2020-05-24 19:45:51,"{'id': 15655302, 'body': 'Thank you for the review. You just said it perfectly - becoming more self aware and putting in the extra effort to turn around the bad days. With gratitude! ❤️ ', 'modified': '2020-05-29T14:32:55Z'}",Incredible app it really helps u become more self aware and has such useful tools to help you through stressful days. If you’re looking to improve wellbeing by becoming more accountable this is definitely a perfect app to use.,5,False,jenn7123,I use this app multiple times a day
41,2020-03-02 16:32:53,"{'id': 14195320, 'body': 'Thank you for the review! You have the essence of Moodfit exactly right - simple steps done regularly can result in change and a better mood. Grateful for you!', 'modified': '2020-03-23T17:58:34Z'}",I use this as a daily mental health “to do” list. I have struggled with mental health most of my adult life (44 now) and this app combines all the skills I have learned throughout my time in therapy and helps me integrate them into my day to day life. The tasks are simple but powerful. Best app for mental health I have come across so far!,5,False,bellydoodles,Seriously awesome!
42,2018-03-11 02:38:46,"{'id': 4599314, 'body': 'Just wanted to say ""thank you!"" for the wonderful review. If you ever have any feedback or questions just send us an email to hello@getmoodfit.com. We\'d love to hear from you! ❤️', 'modified': '2018-08-09T20:11:28Z'}","I use this app really to track my sleep, mood, and meditation. So far, it has worked great. The mindfulness records are amazing, no annoying meditation music, just a calming voice and silence. Very soothing especially as a last minute meditation exercise before sleep.",5,False,ChrisuponTyne,Great app for putting things in perspective
43,2022-09-21 05:51:05,"{'id': 32827153, 'body': ""Thank you for the review! We're always grateful to hear stories about how Moodfit has been helpful to our users. Thank you!"", 'modified': '2022-10-27T21:39:46Z'}","There is so much this app does for me on a daily basis. I track my moods, my sleep, my hydration, nutrition, exercise, vitamins and medications … I could go on. I’ve used it now for over a year, and it has changed my life. I highly recommend it!",5,False,slmjoy,I Love This App!
44,2021-04-28 04:09:14,"{'id': 23215267, 'body': 'Thank you for the review. You 100% get the Moodfit premise - the repetition of simple good practices can reduce stress and lead to change. Gratefully yours!', 'modified': '2021-06-06T03:55:10Z'}","I have struggled with bipolar, panic attacks and ocd for years. Moodfit helps me stay focused on easy to accomplish daily goals which helps me stay grounded and calm. This app helps me feel like I CAN control my emotions when I have a stressful night/day at work. I Love it!",5,False,Becher84,Great for nurses
45,2020-04-07 09:50:37,"{'id': 15655635, 'body': 'Thank you for the review. We’re in the quarantine in California with you! It is challenging for sure! We’re thankful Moodfit has been helpful to you. With gratitude! ❤️ ', 'modified': '2020-05-29T14:53:33Z'}",I’ve struggled with bipolar disorder which can cause me to go into deep depressive episodes especially when I am not able to socialize. This app has made the quarantine of the Covid-19 pandemic in central California tolerable and I’m hoping will be able to help me after the quarantine as well!!,5,False,JessHead2019,Really Helps
46,2020-05-26 12:38:30,"{'id': 15655219, 'body': 'Thank you for the review. If there’s anything we can do to help you get to a 5 star review please drop us an email, hello@moodfit.com. We love hearing about what we can do even better. With gratitude! ❤️ ', 'modified': '2020-05-29T14:28:15Z'}",Fairly intuitive and easy way to help motivate daily tracking.  Customizable elements can be compared to other tracked elements to help you consider lifestyle changes. Supported by published literature. Optional daily tips via app and email add to the MoodFit experience. Have already recommended to others.,4,False,Andii42,Easy to use with goal accountability
47,2020-07-01 15:55:49,"{'id': 16837366, 'body': ""Update: Since we've had things fixed and working well again we hope you'll give Moodfit a try. And we'd love if you'd edit your review as well. Any questions - email us at hello@getmoodfit.com. With gratitude!\xa0\n\nPrevious reply:\nHi... We've had a major snafu with our internet service provider. :( We're in the process of restoring service. If you email us hello@getmoodfit.com we'll let you know when service is restored. We're so sorry for the inconvenience and are working around the clock to get things fixed!\n\n\nHi... We've had a major snafu with our internet service provider. :( We're in the process of restoring service. If you email us hello@getmoodfit.com we'll let you know when service is restored. We're so sorry for the inconvenience and are working around the clock to get things fixed!"", 'modified': '2020-07-23T18:46:02Z'}","I was excited to use this app as i taper down from antidepressants. I was able to use it for two days and now all i get is “No connection- we were unable to connect and get your data” every time i try to open the app. I’m very disappointed, and every time I click app support it just brings me to the apps reviews.",3,False,musicislife1892,Promising idea- but not reliable
48,2019-08-23 00:52:01,"{'id': 10846906, 'body': ""Thank you for the awesome review! ❤️ We have some additional features coming in the Weekly Summary which we think will make it even better. Don't hesitate to reach out to us with feedback or requests - hello@getmoodfit.com. 🤗"", 'modified': '2019-09-23T17:45:23Z'}","This is the most amazing App. I like it because it shows me how I feel. My favorite section is the weekly review because I can read what I did that week and think about it if my mood was the right action for the situation. Absolutely, love this App. It is great.",5,False,PrincesseQD,The Perfect App
49,2021-03-06 22:13:29,"{'id': 22201073, 'body': 'Thank you for the review. Remember that you can change your notifications/reminders anytime you want in the Reminders tool. We have themes like Calming, Distorted Thinking and Gratitude. Changing up these from time to time can help you get more out of them. Thank you again!', 'modified': '2021-04-12T20:34:57Z'}","I personally like this app, particularly the gratitude and mindfulness practices. They help me stay centered and content with where I’m at in life. The little messages throughout the day also make me feel better and surprisingly come up at the right time.",5,False,KittyKat2234,Works great
50,2019-12-03 05:11:41,"{'id': 12259212, 'body': ""Thank you for the review! We're so happy to hear that Moodfit was helpful. Much gratitude to you!"", 'modified': '2019-12-06T23:44:36Z'}","Noticed an improvement within a week. I recommended it to multiple people, it helped those that used it. 
Can’t say enough good things about it. 
I like that negative moods prompt CBT. 
Seriously, it dramatically changes your outlook on life",5,False,Chaula92,Changed my life
51,2020-05-25 17:36:25,"{'id': 15655268, 'body': 'Thank you for the review. So happy to hear how Moodfit has been helpful to you. Like with physical fitness, mood fitness takes ongoing effort. Stay with it and keep building up resiliency to deal with life’s ups and downs. 💪 With gratitude! ❤️ ', 'modified': '2020-05-29T14:31:01Z'}",I’ve literally seen the difference in my mood over the past week and seen the small changes in my attitude in hard situations because of the tools that are available to me. It was a great choice to get this app!,5,False,Irhis Gail,Amazing App
52,2021-03-04 17:38:26,"{'id': 22201084, 'body': 'Thank you for the review! The first step is acknowledging our emotions. Much gratitude for your review!', 'modified': '2021-04-12T20:36:14Z'}","Even without paying for premium, this app is really worth it. I have depression and I find that acknowledging my emotion, I’m feeling a lot better. I would definitely recommend this, and it’s really easy to use :)",5,False,Dubster05,Worth it!
53,2020-03-19 15:12:23,"{'id': 14195269, 'body': ""Thank you for the review Brandon! We have some additional features coming in the gratitude tool. Stay tuned! PS We're very grateful for you! ❤️"", 'modified': '2020-03-23T17:55:12Z'}",This is a great app to help improve your mental health. I have been using this app for a few days now and the quotes and taking time to write down what I’m grateful for have greatly improved my mental health. I am grateful for your app!,5,False,Brandon Conte,Awesome App
54,2019-08-18 23:09:42,"{'id': 10242903, 'body': 'Hi... Update on our response. Wanted to let you know that the latest release now lets you customize your own list of buttons (shortcuts) that you can click to add to the comments of any entry. Let us know if you find this helpful! (And if you do we\'d love to have you improve your rating from 3 to hopefully 5 stars. Thanks!\n//\nHi... We\'d like to help:\n- To edit past entries just go to the History screen which shows all your past entries. Then select the one you want to edit.\n- The next version will have customizable presets for your entries. :)\n- We\'d love to know more about what you mean by ""Navigation is hard."" Would love to have you drop us an email at hello@getmoodfit.com and we can better understand what we can do to help.\nThanks again!', 'modified': '2019-08-19T17:46:11Z'}","The only problem I have: Navigation is not as user friendly as I would like
The premise is wonderful, and I like the way it is set up. I am absolutely grateful for the gratitude section! Makes you think after the entry! 
I wish the entries had a way to add more personalized buttons to the ones already preset....
But overall, I do like the app.",3,False,Mkeekee,"Like, but don’t LOVE"
55,2019-08-22 15:37:44,"{'id': 10846928, 'body': ""Thank you for the awesome review! ❤️  Glad to hear you're liking the customized activities and reminders. Don't hesitate to reach out to us with feedback or requests - hello@getmoodfit.com. 🤗"", 'modified': '2019-09-23T17:46:18Z'}","Great app for tracking and examining mood and any factors that affect your mood: Sleep, exercise, diet, medication, weather, ... anything you want to add. 
Includes nice tools to help me improve my mood and stay positive, including reminders. 
Can set up custom items and easily compare with a history of mood and see personal trends. Can even export the data.
Very insightful. 
Clean simple interface. 
Nice improvements and new features with every version - can add and personalize my own reminders.",5,False,BobertBen15,Great for tracking and improving mood
56,2020-07-30 01:39:51,"{'id': 17614875, 'body': ""Thank you for the review! Very happy to hear it's helpful. With gratitude!"", 'modified': '2020-09-01T00:38:24Z'}",I am a person who starts something and after a short time gets bored with it and moves on. This app won’t allow you to do that. It reminds you throughout the day to stop and assess your feelings! So far the best app for anxiety!,5,False,Tammynation39,Awesome app
57,2022-12-04 10:41:38,"{'id': 30486014, 'body': ""Thank you for the great review! So happy to hear how you're using custom shortcuts to make journaling better. With gratitude!"", 'modified': '2022-06-21T20:14:22Z'}",I am so glad I found this! Love that I can add shortcuts to help make journaling easier. I can easily address eating issues I have and negative thinking patterns. Highly recommend!,5,True,mbnoom,Amazing tool!
58,2021-02-04 16:46:24,"{'id': 20942021, 'body': ""Your hopeful action was rewarded! :) Hope you like Moodfit. We'd love to know what we can do to earn a 5 star review. Thank you!"", 'modified': '2021-02-09T03:17:08Z'}","Only used a few days, but I like the many customizable options even on the free version. Received a msg yesterday about an extended free premium trial for submitting a review but with an expiration date of three days earlier. Doing it anyway and counting it as a hopeful action for the day!",4,False,User124299,Interesting so far
59,2019-05-26 21:48:23,"{'id': 7955613, 'body': ""Thank you for the great review. The best part of our job is when we hear back from users like you that Moodfit is helping them. Don't hesitate to contact us with feedback or suggestions. You can reach us at hello@getmoodfit.com. Much ❤️ to you!"", 'modified': '2019-03-28T19:04:42Z'}",This app is helpful in so many ways. It’s a great tracker; offers really wise advise; allows you to look at your historical data and points out trends; and helps you challenge negative behaviors and thoughts. I highly recommend it.,5,True,Nisijane,Really great app
60,2020-06-22 15:51:33,"{'id': 16837379, 'body': ""Thank you for the great review! Gratitude has great benefits for both the sender and receiver. We're very grateful for you! "", 'modified': '2020-07-23T18:47:54Z'}",This app helps me to focus on the things that will improve on multiple overall well-being and allow me to be show gratitude for things in my life no matter what I may be facing on a daily basis.,5,False,Hiddentm,Love this app
61,2023-03-16 13:04:01,"{'id': 35641352, 'body': ""Sorry to hear about your experience. The connection issues have been resolved. We'd love to have you back. Please email us anytime you have a question, hello@getmoodfit.com. With our gratitude!"", 'modified': '2023-03-28T19:56:14Z'}",This was working great for the first 13 days I used it but then it just stopped working with the message connection issue try again. After 2 days of trying and updating the app it still didn’t work. Two weeks of tracking info that I needed to share with doctor just gone. Bummer! I really loved it when it was working.,1,False,unicornz lol,Worked Great At First But Then….
62,2018-11-26 14:23:38,"{'id': 6394274, 'body': 'Thank you for the review! We love that it’s helpful to you. Let us know of anything new you’d like us to add. hello@getmoodfit.com Thanks again!', 'modified': '2018-12-15T04:35:49Z'}","This app is life changing when you use it. There is an opportunity to do as little or as much as I want to do. You can record, utilize tools, read motivational/encouraging notifications if you choose to.",5,False,Halfull44,The best health app I use.
63,2021-11-26 14:04:18,"{'id': 23206740, 'body': 'Very happy to hear how Moodfit has been helpful. Thank you for the review!', 'modified': '2021-06-04T23:59:01Z'}",This app is fantastic. Especially appreciate the mood tracker and the breathing exercises. I feel much more in control of things rather than things controlling me. Thank you!,5,True,1beggar,Game changer
64,2020-08-21 23:20:07,"{'id': 17614847, 'body': ""Thank you for the review. We're always trying to earn 5 star reviews. We'd love to hear from you what we can do better - hello@getmoodfit.com. Contact us anytime!"", 'modified': '2020-09-01T00:36:56Z'}","Pretty easy to use, I like the mood tracking and CBT tools. You can track everything with the free version, you just can’t see the trends/analysis (like percentage of low moods etc.). It doesn’t bug you to get the paid version like some other apps!",4,False,bobeenafofeena,Useful and free
65,2019-08-07 00:38:32,"{'id': 10846966, 'body': ""Thank you for the awesome review! ❤️ Very glad to hear you're liking the customizations and reminders. Don't hesitate to reach out to us with feedback or requests - hello@getmoodfit.com. 🤗"", 'modified': '2019-09-23T17:47:54Z'}",I really enjoy waking up to little messages the app sends to my phone. I like being able to customize the things I want to track as well.,5,False,Dodie16,Good tracking app so far
66,2020-08-24 17:19:28,"{'id': 17614282, 'body': ""Thank you for the review. Very happy to hear you're putting in the work on the hard stuff. We know it's not easy. We're cheering you on. Gratefully!"", 'modified': '2020-08-31T23:52:20Z'}",This is a really great app. It’s hard to put the work in to change yourself and deal with hard things and this app makes it easier.,5,False,Karebear7363518,Really helpful
67,2021-06-02 16:04:31,"{'id': 23206739, 'body': ""Sorry to hear we didn't meet your expectations. We'd love to hear your feedback. We also have programs to provide financial assistance. Please send us an email, hello@getmoodfit.com. Gratefully yours!"", 'modified': '2021-06-04T23:58:19Z'}","The apps is somewhat helpful with teaching me some techniques to how to relieve some stress, but it’s honestly short when it comes to helping feeling better. Also, that fact the app locks more ways to help stress behind is a pay wall is awful. I recommend finding something much better.",2,False,Seppisaurus,Not Really Great
68,2019-09-23 01:53:42,"{'id': 10846483, 'body': ""Thank you for the review. Very happy to hear Moodfit is working for you. Don't hesitate to give us more feedback or feature requests. You can email us anytime at hello@getmoodfit.com. Keep up the great work. ❤️"", 'modified': '2019-09-23T17:10:52Z'}",I noticed significant improvement in being out of my head and into the present moment very quickly. I was skeptical at first but am a believer now.,5,False,djm2019,Moodfit has worked for me
69,2020-01-29 13:20:44,"{'id': 14195355, 'body': ""Grateful for your review Rachel! So glad you like the gratitude tool. Don't hesitate to contact us anytime, hello@getmoodfit.com With gratitude for you!"", 'modified': '2020-03-23T18:00:16Z'}",It’s a very user-friendly app with helpful reminders promoting mental health and ways to focus on your well-being throughout the day. I especially like the gratitude exercise.,5,False,Rachel JPF,Everyone should use Moodfit!
70,2017-07-15 15:56:30,"{'id': 7955692, 'body': ""Thank you for the great review! We're genuinely grateful. We hope you like the new Reminders feature to keep you on track. Don't hesitate to contact us with feedback or suggestions. You can reach us anytime at hello@getmoodfit.com. Much ❤️ to you!"", 'modified': '2019-03-28T19:10:31Z'}","It has great mindfulness meditations and a host of tools to improve mood throughout the day, as well as a great way to keep track of daily tasks and goals and reward yourself for a day well spent. I love this app!",5,False,Callietitan,Amazing App for people with depression/anxiety
71,2020-08-21 13:31:12,,"What a great app. Using it sets the tone for the day and due to the modules you setup, your working on improving you’re mental health all day. As an anxiety/ panic and OCD sufferer, it keeps me focused on the positive!",5,False,Harley1491,So helpful ! I can tell when I miss a day
72,2020-05-22 12:47:18,"{'id': 15655354, 'body': 'Thank you for the review. You’ve got it - awareness is a big first step toward a better mood. With gratitude! ❤️ ', 'modified': '2020-05-29T14:35:52Z'}",Allows you to take a moment to think about how you're feeling and write it down. Acknowledgement of your feelings,5,False,notenufsleep,Makes you think
73,2021-10-25 11:17:40,"{'id': 27241948, 'body': 'Thank you for the review. Very happy to hear how Moodfit has been helpful!', 'modified': '2022-01-05T00:36:13Z'}","Moodfit has helped me identify weaknesses. I live having a place to journal gratitudes. The CBT is great to help correct negative thinking. I turn to CBT when needed. 
Highly recommend!",5,False,anonymoys2,Very helpful
74,2020-05-05 06:04:27,"{'id': 15655530, 'body': 'Thank you for the review. We’ve recently started the Moodfit Moment emails to give you short little tips and inspiration. Perhaps they help with being a reminder. Send us a note anytime hello@getmoodfit.com. We’d love to try to earn a 5 star review from you. With gratitude! ❤️ ', 'modified': '2020-05-29T14:47:10Z'}",I have a hard time reminding myself to go on the app but it has a variety of things that help remind you to check in and I think that’s wonderful as a bipolar person.,4,False,Rjwonton,Many options
75,2020-07-15 04:17:53,"{'id': 16837333, 'body': 'Thank you for the review! So happy that Moodfit has been able to help you during the challenging covid times. Keep going! Let us know how we can help.', 'modified': '2020-07-23T18:37:56Z'}","I am so thankful for this app, and the thoughtful, responsive team behind it. Has really helped me stay at my best during COVID. Well worth the free trial, and worth the paid plan as well.",5,False,SuspensionBridget,Got me through quarantine
76,2021-04-28 12:01:53,"{'id': 23215257, 'body': ""Thank you for the review and for telling your husband about Moodfit. Very happy to hear it's been helpful with focus. Gratefully yours!"", 'modified': '2021-06-06T03:53:35Z'}","This app is a must! Has carried me through the pandemic, helping me focus on my strengths & providing me help with focus. Got my husband using it now & we are grateful for it.",5,False,mrw123,So helpful
77,2020-07-01 12:52:47,"{'id': 16837371, 'body': ""Update:\xa0\nSince we've had things fixed and working well again we hope you'll give Moodfit a try again. And we'd love if you'd edit your review as well. Any questions - email us at hello@getmoodfit.com. With gratitude! \n\nPrevious reply:\nHi... We've had a major snafu with our internet service provider. :( We're in the process of restoring service. If you email us hello@getmoodfit.com we'll let you know when service is restored. We're so sorry for the inconvenience and are working around the clock to get things fixed!"", 'modified': '2020-07-23T18:46:45Z'}",App was very useful for the first day... now I’m receiving an “unable to connect” message.  My internet and phone are fine and are having no problems with other apps/web.  This has been for the last 2 hours.  I’ve emailed support but haven’t heard back.  Hope this isn’t what I have to look forward too with this app now that I’ve paid for months in advance.  Urg.,1,False,Posh327,Hmmm
78,2020-09-20 16:21:19,"{'id': 18605742, 'body': ""So glad to hear you're finding Moodfit helpful. With gratitude!"", 'modified': '2020-10-20T23:34:28Z'}","I love that you can determine what activities you want to do, how many times a week, and on what days and times!!  The reminders are really helpful too!!",5,False,itzmetinab,Love it!
79,2020-01-03 22:40:50,"{'id': 12754089, 'body': 'Thank you for the review! Awesome to hear that Moodfit has helped you form new healthy habits. Much gratitude to you!\n', 'modified': '2020-01-06T19:41:35Z'}","After three weeks of using MoodFit every day, to set and track goals, mood, etc. for the first time I have been able to actually form new healthy HABITS.",5,False,FoldedBee,I love this app!
