,date,developerResponse,review,rating,isEdited,userName,title
0,2022-01-31 21:42:00,"{'id': 28341111, 'body': 'Thank you for the review! We do try to provide a lot of value even in our free version. Thank you again!', 'modified': '2022-03-02T17:37:58Z'}","This app is the best free mental health tool I’ve ever come across. The fact that it’s free and you have access to almost every feature without holding back the most important things that will truly help a person truly shows that those who made this care about others genuinely. Unlike meditation and other self-help apps that charge exorbitant amounts of money they are able to positively effect those who are searching for, and need, the help they deserve but can’t afford it. I am truly grateful I live in a world where I know developers like this exist and it gives me hope that there are more out there that still aim to use technology to reach out and help others, not just make a profit. As soon as I can afford it I want to make a point to buy a membership because I believe in their cause and I hope they become the number one app for self-help across all application stores.",5,False,Bucwinger,True Altruism
1,2021-01-03 20:28:01,"{'id': 20562233, 'body': ""Thank you for taking the time to provide this feedback. It's very helpful and something we want to incorporate into future versions. Gratefully yours!"", 'modified': '2021-01-21T20:13:24Z'}","I love this app very much. I really like all the tools it has to improve mood. The primary reason why I am giving this four stars instead of five stars Hass to do with the accessibility with voiceover. Voiceover is an accessibility service that changes how the device works to help blind and visually impaired people like me use the touchscreen. In order for voiceover to work well, the app and the interface Hass to be programmed right. Don't get me wrong, because I do think this is one of the most accessible apps for mood out there, but it is lacking a couple of things with voiceover accessibility. For example, when I try to customize the days for a reminder, voiceover does not give me any indication of which days are checked off. For the days that are checked off for the reminders, why not have voiceover say something like M selected or M checked? That would give blind and visually impaired users an indication that Monday is checked off. Otherwise, everything else about this app is great. If it wasn't for the voiceover accessibility problem, then I would give this five stars.",4,False,KNE06482,"Love this app but, …"
2,2022-05-27 15:03:36,"{'id': 30485989, 'body': ""Thank you for this review! You have it so right - everyone is different with respect to sleep. Tracking and inspecting what works or doesn't work is at the root of improving sleep. With gratitude!"", 'modified': '2022-06-21T20:13:07Z'}","I have struggled with sleep since I was a child, but have never thought to journal it until recently. This app has been great for that, it helps me track how many nights of poor sleep versus how many nights of decent sleep I am actually getting. I include factors in my entry that could be impacting my sleep, such as caffeine consumed during the day, exercise, stressors of the previous day, alcohol consumed the previous day, etc. It has been really helpful to be able to look back and see what factors help and what factors hinder sleep. I also use the mood tracking function so I can observe how mood and sleep correlate with each other. I decided to just stick with those two things for simplicity, but I like how many different things there are that you can track with the app.",5,False,AbbaZabbaPanther,"Simple, easy to use"
3,2018-08-05 15:48:20,"{'id': 4599296, 'body': ""Hi Charlotte... Thank you for the review! We'd love to chat more about the weekly reports and gratitude. If you send us an email to hello@getmoodfit.com we can explore new features to address this for you. Hope to hear from you. Thanks!"", 'modified': '2018-08-09T20:06:16Z'}","I’ve tried almost all of the mood/CBT/depression/anxiety/mental health apps on the market and I can’t say enough good things about Moodfit. You can track as few or as many things as you’d like - from mood and sleep to mindfulness, medication, and socialization. It offers encouragement and tips to help you navigate your way out of a negative mood, and you can add as many or as few details as you want. The smallest of caveats - I wish the weekly reports had a bit more summarization, but with some things (like gratitude), I know that can be hard to do. Maybe a question at the end of the gratitude section, e.g. how grateful do you feel today, would help? Overall, though, again, you can’t go wrong with this app.",5,False,Charlotte Singer,Can’t go wrong - love all the customization available!
4,2021-11-05 01:55:27,"{'id': 27241939, 'body': 'Thank you for the thoughtful review!', 'modified': '2022-01-05T00:35:34Z'}","I really appreciate all of the different features in this app, especially the mood tracking and gratitude listening. There is a history feature which allows you to chart your mood changes over time which helped me to better understand patterns I was experiencing. The grounding tool has helped me when I am experiencing sudden anxiety. I tried the free version which was great, but ended up upgrading to the paid version which has been a worthwhile investment for me. This app along with therapy have really been beneficial. If therapy is not an option for someone at the present time, the CBT resources in this app could be helpful in working through thoughts and feelings.",5,False,marbles257,Helpful app!
5,2021-06-25 16:41:02,"{'id': 23605195, 'body': 'Thank you for the review! We’re grateful to hear how Moodfit has been helpful and that you like the CBT tool. 🤗 ', 'modified': '2021-06-27T02:31:55Z'}","The app is pretty awesome to be honest. I never thought I’d be keeping track of my moods through an app but here I am…. And it’s definitely helped me with keeping track of my moods and other daily goals I set. The CBT part of the app is probably my favorite though. Anytime I have distorted thinking, I’ll go in the app and write out why I was feeling the way I was, or at least try to figure out why I was feeling like I was and try to work through it so I can try to rewire the way my brain acts I’m certain situations. I have adhd, bi-polar disorder as well as a couple other disorders and this app has definitely helped in keeping me somewhat sane…. Try it out!",5,False,Jameswithadhd,App has helped me out a lot 💪
6,2022-06-14 12:22:04,"{'id': 30485947, 'body': ""So happy to hear you're finding Moodfit helpful! Hearing that truly is what makes us smile. Thank you for the great review!"", 'modified': '2022-06-21T20:11:07Z'}","This app has been a game changer for my mental health. I love the simplicity, customization, and the thoughtful details ( for instance, love how it lets you savor your gratitude by playing it back for you before saving) I have tried a number of other mental health apps to track my daily wellness goals and routines, but they have fallen short. This one is my fave ever, and makes it a joy to check off the goals that I set. Big thank you to the  developers! Especially for making the basic version actually useful and beneficial too.   It has been a lifesaver. Thank you.",5,False,Randy310,Love this app for mental fitness so much
7,2019-03-09 17:24:48,"{'id': 7955644, 'body': ""Thank you for the great review! We're genuinely grateful. It's humbling when we hear directly from users how Moodfit has helped them. Don't hesitate to contact us with feedback or suggestions. You can reach us anytime at hello@getmoodfit.com. Much ❤️ to you!"", 'modified': '2019-03-28T19:07:14Z'}","I love this app. I suffer from anxiety and depression. This app helps me stay focus on my daily goals and basic self care. It’s a simple app but that does not make it less effective. My favorite parts are the ability to add your own goals, the weekly updates, and the motivational articles. I do love that I can track my mood over time so I can see how I’m doing or if I’m about to go into a down cycle. There is so much to love about the app that I can not put it all here. If you have mental health issues I do recommend this app highly.",5,False,myemmanuel,This app really does help
8,2021-03-01 02:04:45,"{'id': 22201095, 'body': 'Thank you for the review. We have worked to improve the performance. Please drop us an email, hello@getmoodfit.com and let us know exactly what activity is taking too long so we can address it. Thank you again!', 'modified': '2021-04-12T20:37:38Z'}","I truly love this app. I've been using it since around September 2020, and I am starting to schedule it back into my routine again. It helps me to develop a schedule around understanding my emotions and anchoring me during rough parts of the day. 

The only thing that I wish was better was how long the loading time is when I update an activity. Navigating the app is a difficult because the page-loading-time is slow, even when connected to stable WiFi. This is something that needs to be improved upon, especially when you have a subscription. However, it is a wonderful resource despite app navigation.",4,False,26454!,Amazing!
9,2020-11-21 14:38:07,"{'id': 20562349, 'body': ""Thank you so much for the awesome review! We're gratified to hear all the ways you're finding Moodfit helpful. With much gratitude! "", 'modified': '2021-01-21T20:21:22Z'}","This app is amazing. I have adhd and anxiety and I’ve been struggling to track my mood/focus and other things daily to see how It changes throughout time. This app allows me to track my therapy sessions, medication, sleep, time spent on mindfulness, exercise, etc. which really helps me visualize the circumstances surrounding my feelings and mood that day. I’ve used a lot of apps similar to this but they’ve all been separate apps. This app is everything I need built into one. Highly recommend !",5,False,MegaSoccer94,Best mental health app I’ve used
10,2020-06-04 10:13:21,"{'id': 16082369, 'body': 'Thanks for the review! We love it that you’re finding it helpful! ', 'modified': '2020-06-18T23:37:03Z'}","I like the daily messages. They can help you think differently about your feelings and give you encouragement at the same time. Using this has helped me to track my mood and sleep patterns better. As well as helping me to remember the good things that happen each day, with an overview at the end of the week. I am still new to using this and will be exploring more of the options available. Thanks for making it easy to use!",5,False,Shay 'Stein,Offers everything I was lookin for in an app like this.
11,2022-10-22 17:32:22,"{'id': 32827159, 'body': ""Thank you for the review! We're very happy that you found us. With gratitude!"", 'modified': '2022-10-27T21:40:29Z'}",I have been struggling with my mood as well as insomnia for 6-7 weeks and I read about this app in bphope the magazine focusing on information and support for people with bipolar disorder. I loved the app the first time I tried it and I love the positive effects I had from tracking my moods. I also am incredibly grateful for the positive things that are offered when my thinking is negative and suggestions for how to make my thinking more positive.,5,False,Positivity is FOUND,Helpful for feeling empowered
12,2023-03-29 20:22:48,"{'id': 35902273, 'body': ""Thank you for the review. Glad you've joined us!"", 'modified': '2023-04-12T01:30:04Z'}","I just got this app last night, so I’m exploring. So far, I like it and probably will go to the prime version.

Okay, I just did go to the full version. I get a free week to test it out and the price afterwards is great. Cheaper than Weight Watchers, monthly, even better for a full year and I think that it will help me realize what makes me eat and drink, something that a weight loss program doesn’t do or doesn’t do well.",5,False,P. Feather,"So far, so good."
13,2022-04-27 22:49:17,"{'id': 30486062, 'body': ""Thank you for the great review! You're so right - it's not about pushing away a low mood. Instead it's about awareness, acceptance, and taking basic good self-care steps. With our gratitude!"", 'modified': '2022-06-21T20:16:34Z'}","First day and already in love with with this app. Having a rough afternoon and after reporting a low mood the app walked me through breathing, reminders, and actions I can take to help. Not necessarily to get rid of the emotion but to process it, which is exactly what I needed. Love that there are spaces to type my comments to help with the processing. All using just the free version! Would love to expand to use their other tools like CBT.",5,False,Lorree22,Even the free version is helpful
14,2019-11-29 07:26:21,"{'id': 12754148, 'body': ""We're grateful for your review! You have totally nailed the essence of Moodfit - giving users more agency and control over their lives and improving their moods. Thank you!"", 'modified': '2020-01-06T19:44:40Z'}","I’m traveling a lot and have been unable to find a routine for myself to help manage my mental illness, much less find time or space for traditional therapy. This app has been an absolute game changer in giving me the structure to stabilize my moods during this transitional period. This app has fundamentally changed the way I think about dealing with my mental health, and made me feel like I have more agency and control over my chaotic life. Cannot recommend it enough!",5,False,madino78,Best tool I’ve found
15,2022-01-03 08:52:15,"{'id': 27241913, 'body': 'Thank you for the review! With gratitude!', 'modified': '2022-01-05T00:33:54Z'}","This is an “all in one” app where you can customize a large variety of goals to accomplish in bite size daily pieces. The app guides the user through every step, educates the user on the benefits of every exercise (complete with scientific articles), and gives customized encouragement throughout the day. I personally use the cbt therapy, prayer, exercise, mood, meditation, gratitude, breathing, acts of kindness, nutrition and sleep tools.

Best wishes on your journey!",5,False,Keep on shuffling,Great application!
16,2018-04-05 06:08:42,"{'id': 4599311, 'body': 'You just made our day! Thank you so much for the wonderful review!! ❤️', 'modified': '2018-08-09T20:10:21Z'}","Seriously the easiest app to use ever. I'm BP1 and it's so freaking helpful if I actually use it. It's free and it works. 

I understand there are plenty of other options on the market for mood journals but this app's easy interface keeps me using it. I'm still learning new stuff daily with it but I love it. I've tried others, and keep a handwritten journal, & calendar app on my phone. This is little effort and works. The less effort the more likely I return. Just saying. We all lazy in some aspects. If I'm having a manic episode it walks me through prompts with simple questions. 

Customer service has been great too & genuinely like their jobs and want to help. 

Note: I'm not paid to write this review. I want people to try this. I love trying new things.",5,False,TheGirlCanCook,"Holy Awesome App, Batman"
17,2022-11-03 12:04:00,"{'id': 33462338, 'body': 'Great suggestion - thank you! This is on our list. Stay tuned.', 'modified': '2022-11-30T23:57:08Z'}","This app would be greatly improved if it included a tool about the menstrual cycle. It doesn’t have to be complicated, and could be designed to fit into the app similarly to the other tools. But considering how menstruation affects mood/productivity/nutrition needs, etc, one would think such an important category would be included in this app. And let us remind ourselves that menstruation effects MANY people, regardless of gender. Please include this category, your users will thank you for it.",3,False,sknappsknapp,Needs cycle category
18,2021-02-12 00:08:21,"{'id': 21119944, 'body': 'Thank you for the review and for recommending Moodfit to your clients! BTW, we have a program for therapists to make Moodfit available to their clients. Email us, hello@getmoodfit.com and we can send you details. Thank you again!', 'modified': '2021-02-17T18:19:59Z'}","I have been testing several free emotion trackers as a therapist to recommend to my clients and this one is my favorite. It’s not super fancy or cute like some of the others, but it is incredibly easy and straightforward, and has several helpful (and research based) tips and skills for different moods and such. It does a lot more than track mood, but food, exercise, gratitude, etc. The designers did a great job.",5,False,Hne913,Free Yet Complete
19,2021-03-12 15:28:10,"{'id': 22201040, 'body': 'Thank you for the review! So happy to hear that Moodfit helped you get back to the basics and to get moving and taking action. Gratefully yours!', 'modified': '2021-04-12T20:31:24Z'}",I was stuck in a lot of laziness and bad habits and didn’t know what steps to take to bring myself out of it. This app is helping me be mindful and take action in my life rather than letting it pass me by. I can’t wait until a year from now when I get to look at my progression and actually see the improvements I’ve made. Awesome app! Would recommend!,5,False,frederick II,Getting out of a slump
20,2020-05-28 23:13:15,"{'id': 15655158, 'body': 'Thank you for the great review! It makes our day when we here how Moodfit is helping users. Much gratitude to you! ❤️', 'modified': '2020-05-29T14:24:41Z'}","The app encompasses all the tasks/skills that my therapist has been encouraging me to do! The app has been exceptionally useful to help hold myself accountable to reach out to others and maintain a healthy lifestyle because, like the app says, it helps my mental heath too. The Moodfit team even sent me an article on advice for working night shift because I have been struggling with work/sleep/mood balance.",5,False,Tessoxo,Exceptional!
21,2020-07-31 23:29:23,"{'id': 17614905, 'body': 'Thank you for the review! With much gratitude!', 'modified': '2020-09-01T00:40:18Z'}","Thank you, 
I appreciate the notifications with encouragement. 
The situation has gone on so long that friends and family are over it. There’s very little reason to keep discussing a situation that we have no control of.  It’s important to think about my feelings and gratitude even if it’s with an app. I can tell that much thought went into the development.",5,False,lynndar,Thoughtful
22,2021-01-06 07:15:15,"{'id': 20562205, 'body': 'Thank you for the great review! So glad to hear that Moodfit has been helpful to you to get through the challenges of 2020.', 'modified': '2021-01-21T20:11:44Z'}","I have found Moodfit to be such a helpful app for me. 2020 has been a challenging year consisting of a lot of change that hasn’t been fully processed. This app has helped me slow down, put negative thoughts into perspective, and focus on gratitude and mindfulness, which is helping so much as I progress into this new year.",5,False,Mick1984.,Amazing app!
23,2020-11-21 00:31:37,"{'id': 20562370, 'body': ""Thank you for the 5 star review! We're so happy to hear that Moodfit is helpful. We're also excited for you on your journey ahead! Much gratitude!!"", 'modified': '2021-01-21T20:22:12Z'}","I have realized recently that I’ve been going through life on autopilot, having trouble with handling my emotions. Downloading this app has been so helpful to me! It’s helping me to take time for myself each day and think about how I feel and why I feel that way. I’m excited for the journey I have ahead of me.",5,False,magpie69x,Learning so much about myself
24,2019-02-11 05:11:43,"{'id': 7955661, 'body': ""Thank you for the great review! We're genuinely grateful. Please don't hesitate to contact us with feedback or suggestions anytime at hello@getmoodfit.com. We want to keep growing the app to meet your needs. Much ❤️ to you!"", 'modified': '2019-03-28T19:08:24Z'}","It’s got everything you could need, plus whatever you want to throw in! I’ve spent the past month trying different apps for different types of help ie awareness, meditation, journaling, cbt, etc, then BAM!!! Moodfit y’all!!! Seriously, I’ve got much gratitude and appreciation for this app and the folks behind it! Thank you so much, your work is invaluable to myself and others.",5,False,zensdaddy,Love it
25,2023-04-19 22:34:24,,So far so good!  Therapist recommended I use a mood tracker and this one is simple and fun and not annoying like other apps can be some times! As a marketer myself I’d personally change the color pallets/branding if it were my app but that’s just my preference.  The intentions of this app seem good!,5,False,M@ClubSoda,Seems to do what I need it to do.
26,2019-11-09 21:32:55,"{'id': 12259218, 'body': ""Thank you for the review. Awesome to hear that Moodfit has helped you slow down and be more mindful and that you're keeping a gratitude journal. Much gratitude to you!"", 'modified': '2019-12-06T23:46:09Z'}",Love the reminders during the day. It really seems to know when to remind me to slow down and be mindful. Keeping a gratitude journal is new to me but has been surprisingly helpful to keep me looking at the positive. Also want to try the breathing exercises next. Just love coming to the app daily has made me much more aware of how I feel.,5,False,jmur25,Grateful for Moodfit
27,2020-06-03 17:45:38,"{'id': 15655434, 'body': 'Thank you for the review. We’re glad we can be here to help. Don’t hesitate to contact us anytime with questions or feedback, hello@getmoodfit.com. With gratitude! ❤️ ', 'modified': '2020-05-29T14:42:21Z'}","I recently had a health issue and the Mood app. Is really helpful in getting me back on track.  I have enjoyed using it everyday & will continue for the next 3 months for sure!

I like this app a lot for keeping track of my daily goals.   I especially like the gratitude part of the app.",5,True,Bike Riding Lady,Mood App.
28,2021-02-18 15:15:35,"{'id': 22201150, 'body': ""Thank you so much for the review! We hope you've discovered the custom shortcuts that you can create to make identifying and entering journal entries easier. Gratefully yours!"", 'modified': '2021-04-12T20:40:32Z'}","I have tried multiple apps to help with my anxiety & depression- this one allows me to track everything in one place, making it very easy to describe my moods in words- helps me to refocus with positive prompts- which I can change the topics of easily. I am a pen & paper girl, but this app helps me consistently track the things I want to!!",5,False,tsnowdy625,Keeps me focused!
29,2021-03-25 15:55:21,"{'id': 22201029, 'body': 'Thank you for the review! Send us an email, hello@getmoodfit.com. And we can try to help you with a student discount.', 'modified': '2021-04-12T20:30:38Z'}","So I’m a broke college kid so I can’t pay, however with the tools of the reminders and even having the 6 daily activities have done WONDERS for my mood. Thanks developers for making free aspects still very very useful, it’s been hard trying to find something that’s free. I really am deeply grateful for this app :)",5,False,Legendary app!,Free version is still 5 star
30,2022-03-09 11:13:45,"{'id': 29338379, 'body': 'Thank you for the review. Best part of our day is when we hear how Moodfit has been helpful to users. So glad you love the ""savor element to the gratitude tool. Thank you!', 'modified': '2022-04-22T18:07:39Z'}",Was feeling depression come in (I’m on meds but sometimes there are breakthroughs). Read a recommendation of this app somewhere and downloaded and it righted the ship. Love the alerts throughout the day that get me to slow down and think differently and my favorite is the gratitude piece that flashes your answers.,5,False,FWoke,Love it
31,2021-03-05 16:16:50,"{'id': 22201078, 'body': 'Thank you for the review! With much gratitude!!!', 'modified': '2021-04-12T20:35:22Z'}",I am really liking this app.  I love that there are so many options for customization that make the  mindfulness activities personal for what I need.  I like that the sources are listed on the educational materials so I can read the actual research if I want. This is the most comprehensive app for mindfulness that I have found.,5,False,Anacronyzm,Love the customization
32,2019-09-27 16:07:59,"{'id': 11560467, 'body': ""So glad to hear you're finding Moodfit helpful! Don't hesitate to send us more feedback along the way, hello@getmoodfit.com. Much love your way!"", 'modified': '2019-10-30T17:17:09Z'}","I’ve tried many apps, and all have helped somewhat, but this app is amazing in getting me to return every day and reflect on past moods! Bonus- it’s free! Which is amazing because other apps usually have subscriptions nowadays. It makes it easier for people in a tight budget to get the help they need!",5,False,rockstarmonkey123456789,This app helps a lot
33,2023-04-09 14:45:13,"{'id': 35902302, 'body': ""Thank you for letting us know. We're sorry we disappointed you. Our server upgrades took more downtime than expected. We hope you'll come back and try us again sometime."", 'modified': '2023-04-12T01:31:57Z'}","I depend on this app quite a bit to track mood and focus on self-improvement. Lately, it’s been far too unstable and there have been several days where the app is completely inaccessible due to “connection issues”. This has also broken two streaks I had going which sounds silly, but is something I use for motivation. App is good when it works, but has become far too unreliable",2,False,CourtZierk,Too Buggy
